{
  "schema_version": "1.0.0",
  "project_id": "project.demo",
  "run_id": "run.p3.theory.20260802t140000z",
  "manifest_sha256": "aaaaaaaaaaaaaaaaaaaaaaaaaaaaaaaaaaaaaaaaaaaaaaaaaaaaaaaaaaaaaaaa",
  "current_state": "cancellation_requested",
  "events": [
    {
      "sequence": 1,
      "event_id": "event.cancel.created.001",
      "prior_event_sha256": "0000000000000000000000000000000000000000000000000000000000000000",
      "to": "created",
      "at": "2026-08-02T14:00:00Z",
      "actor": "user",
      "reason": "The researcher submitted the Phase 3 command.",
      "event_sha256": "4a44b0ccb36f18212668f6e42810b15233ae7f2b7b8441757827249964e48cee"
    },
    {
      "sequence": 2,
      "event_id": "event.cancel.preparing.001",
      "prior_event_sha256": "4a44b0ccb36f18212668f6e42810b15233ae7f2b7b8441757827249964e48cee",
      "to": "preparing",
      "at": "2026-08-02T14:00:01Z",
      "actor": "system",
      "reason": "The harness began preparation.",
      "from": "created",
      "event_sha256": "9ee7320e52711c2333cc808c58a9eaf171a44d12dd31237db12a48b7d65bfc63"
    },
    {
      "sequence": 3,
      "event_id": "event.cancel.prepared.001",
      "prior_event_sha256": "9ee7320e52711c2333cc808c58a9eaf171a44d12dd31237db12a48b7d65bfc63",
      "to": "prepared",
      "at": "2026-08-02T14:00:02Z",
      "actor": "system",
      "reason": "The harness sealed the run manifest.",
      "from": "preparing",
      "event_sha256": "bc106e5c76b16f422de5c63e75fe671522d5dc69ad82cab56cfa575af7cc72f0"
    },
    {
      "sequence": 4,
      "event_id": "event.cancel.running.001",
      "prior_event_sha256": "bc106e5c76b16f422de5c63e75fe671522d5dc69ad82cab56cfa575af7cc72f0",
      "to": "running",
      "at": "2026-08-02T14:00:03Z",
      "actor": "system",
      "reason": "The harness started role execution.",
      "from": "prepared",
      "event_sha256": "8184ded221612977253015d00b6b01d5fa78341349a4a0cc25f8da86ca6d64b5"
    },
    {
      "sequence": 5,
      "event_id": "event.cancel.requested.001",
      "prior_event_sha256": "8184ded221612977253015d00b6b01d5fa78341349a4a0cc25f8da86ca6d64b5",
      "to": "cancellation_requested",
      "at": "2026-08-02T14:20:00Z",
      "actor": "system",
      "reason": "The authenticated cancellation command closed the submission and new-role gates.",
      "from": "running",
      "command_source": {
        "command_type": "run_cancellation",
        "command_id": "command.run.cancel.001",
        "command_sha256": "5d1815ee03229f6405fbae34c98a5ed297b5c5e7c753517d385fd29d0c0c6348",
        "requested_by": {
          "user_id": "researcher.demo",
          "operating_actor_type": "authorized_remote_operator",
          "operator_id": "operator.hermes.demo",
          "delegation_id": "delegation.research.operator.001"
        }
      },
      "event_sha256": "46adc8d898393e678216ba447bc6622dfc9888a939ab0da5d487c3d7fd92871f"
    }
  ],
  "journal_root_sha256": "46adc8d898393e678216ba447bc6622dfc9888a939ab0da5d487c3d7fd92871f",
  "updated_at": "2026-08-02T14:20:00Z"
}
